id,text
278,"there was this murder and no one basically had any leads. there was a man in a shallow boat like structure and he was bloody but still in one piece. me being me i went to the crime scene multiple times to see if i could find anything. well it’s dark now and i see this truck pull up and this man get out. he does something i can’t see (to the crime scene) then gets in a drives off. well days later a women shows up to me and rushes me away “we have to go now it’s not safe here” so immediately i’m like woah who are you and she never answers..then there is a hole in my dream and it skips to a point where the woman and the man i saw earlier have confronted eachother . well the short way of telling the end of this dream is woman (red hair pulled into a pony tail,skinny structure,kind of short but tall too so average height, green eyes, wearing an all black wet suit almost) has now killed the big man in the truck after a long fight over something i have no knowledge of(big muscular man,no hair,black jeans,white t shirt,reddish brown beard,black shoes) and she’s now bagging up his body and throwing it in the dumpster across the riverside. then somehow we’re inside and there’s now blood everywhere but i don’t remember why. she’s scrubbing vigorously trying to get rid of any traces. by this time it’s daylight and the cops are arriving. well the women freaks out and goes to the door acting calm as ever and tries to talk them out of needed to search the place. well it doesn’t work so she hits the cop over his head and we are now running. that’s when i woke up)"
282,"The most recent dream I can recall took place three nights ago. I was back in high school, but it was some kind of mix between the high school I attended, Free State High School, and a school from a 1970s-set high school movie like Dazed and Confused. The school had 4 floors and a huge open courtyard, overlooked by balconies connected to classrooms. Outside of the school, the dream was mostly set in the car that I owned, a teal 240SX. This car was extremely quick, but handled like it had no steering wheel and was unpleasantly uncomfortable. No matter how I oriented myself in the driver's seat, I was always too close to the dashboard and couldn't press my foot on the clutch to change gears. My extreme happiness of owning the car was at times ruined by the moments when I couldn't control it. When I wasn't in this evil car, I was skateboarding with superhuman skill at the skatepark behind the school."
283,"I dreamt that my boyfriend and I were in a ghost town alone and he got really drunk and was super annoying and rude to me and then kept disappearing and being very hard to track down,"
286,I had a dream I was sleeping at my boyfriend's house and his roommate came into the room when I was asleep
293,"I was at my skating rink, and I had broken my ankle. It was a nice day outside, the sun was shining and i was coming out of the front doors about to walk down the stairs. As I was walking down I broke my ankle, and it hurt really bad. I sat on the ground and tried to call my mom. She picked up the phone and didn't really care what had happened to me. I sat there crying and I could feel the pain of the sobbing in my chest. I couldn't catch my breath because of how much I was crying and how much my leg hurt."
294,"I had a dream last night that I had to have a lab meeting with my mom and we for some reason had Indian food. Anyways I think I had it because I am worried about meeting with my research lab on Thursday since I have not done enough work for it yet. I think my mom being in my lab meeting in my dream was a sign that I need to get my work done so I do not disappoint her. Except at the end, it got less stressful because everything ended up okay and we all just ate the Indian food together. But now I am stressed about doing the work again after having the dream."
297,That i was swimming and I won the olypmic gold medal
298,I was at a mountain resort with my boyfriend it was very golden and Red colored. There was a buffet with so much food. It was my birthday and it was a surprise party for me. Friends were there. It was exciting
300,"It was like a monster survival situation. I knew that it was a dream so it was a bit thrilling but still felt a bit scared because I might still be able to feel pain. I was at my apartment when suddenly monsters started to flood in. I hid inside a brown mansion and eventually survived, even with the threat of some popcorn monster that disguised itself as a harmless snack."
304,"I was dreaming that the only ay to fic my mirror in my room was to change the batteries. I didn't really feel a certain way towards it, it was just a situation that happened."
305,i was happy and dancing with friends
308,i was going to texas with my boyfriend and all of my friends and it was alot of fun.
315,I was in my dorm room (first person) and on the other side of the jack and jill bathroom was my old crush.  I had no feelings for him but he kept trying to add me on socials.  I told my current boyfriend and he broke up with me.  I started crying and could not control myself.  I woke up with tears in my eyes.
324,"I had a dream the other night, and I was in a hair salon, and I was sitting in the chair playing on my phone, and when the hairdresser said that she was done, I looked up and she had given me bangs. I had not told her to give me bangs, so I was very shocked, but they actually looked good, and I liked them, so I didn't get mad at her. I remember feeling scared when I saw them, but I relaxed once I realized they looked good."
327,"I was back at home in Colorado. I was running on the hardwood floors in an anxious, panicked state of mind but I wasn't sure why. I realized soon that I felt this way because my crush was sitting in the living room waiting for me. I was shocked to see him as I walked downstairs, therefore I ran to my mom for help in the office, which was down the hall from the living room. I started helping her hang up the laundry that just came out of the washer. The shirts smelled clean and fresh, and they were slightly damp. I started nervously talking to my mom saying that he was in the living room, and she responded very calm and collectedly. She said she invited him over and I dropped the hangers in my hand. As I picked them up, I had a crazy impulse, and I acted on it. I ran out of the room and over to him, ensuring my mom couldn't see us, and I kissed him. Kissing him gave me such a rush because I had never kissed anyone before. As I ran my fingers through his hair, I quickly realized what I had done and I broke the kiss. I sprinted to my mom and I locked the door of the office behind me. I started panicking and I told her that I kissed him as she looked at me with curiosity. I sat down on the soft carpet. My mom started asking me questions about why I did it and how I felt about doing it. Some part of me was happy, but another part of me was so confused because I do not usually act on impulse. I stood up, thanked my mom for listening to me, and I walked out of the room. As I opened the door, I woke up from my dream."
330,I was sweating and scared when I looked down and saw that I had ring worm on my hand. This made me terrified I was thinking what will I do how will I make this go away its so gross. Then all of the sudden as im looking down at my hand the ring starts moving. this worm is crawling under my skin. I have never felt so much fear and disgust. I didnt know what to do so I ran to my mom to show her the sight of the worm moving around up my arm. My mom tried to help me get it out. Eventually somehow she did get the worm out and there was a feeling of relief but when i looked down again more had spawned onto my hand and I was back to fear and disgust. Then I woke up in a sweat. Worst dream ever.
337,"I had a dream about eating cheese puffs, and I thought it was so real that I woke up and literally licked my fingers."
339,"In the dream I had a ghost looming over me and I felt a sense of dread because I knew I couldn't do anything about it. Eventually, I had some sort of exam over something that I hadn't studied at all but when I got to my desk I fell asleep again and had a dream inside of my dream where I asked someone how to kill the ghost. I eventually got a special sword in my dream and when I woke up, I was no longer in math class but instead some parking lot and I found the ghost and killed it with the sword. I woke up from the dream immediately after killing the ghost."
342,"All of my high school friends cam and suprised me at college and it made me feel really happy, because i haven't seen them in a while and it has been hard without them."
344,"I dreamt last night that I was in a big house with my friends, some random people, and some of my customers from work. My friends and I were trying to solve a mystery/ investigate the house for the bad guy. There was a big conflict but the bad guy was eventually caught after my friends and I were all seperated and hid in fear. Then we all went to sleep in the giant house. We woke up, got ready to head home, and then one of my regulars tried to inadvertently flirt with me."
346,The dream was in first person where I started in an open field. There was a light gust of wind with the sound of the grass moving in the direction of the wind. It was dark outside with the only thing visible being the grass close by. I was frozen and staring out into the field and I quickly turned my head the right to the sound of a door opening. I turned back around to being in my room and feeling of panic that I was being dragged out of my body. I felt a sense of pressure and pain like i was being pulled up. There was no one else present besides me but I could hear breathing close by as i was being pulled up. As I kept being dragged fear and panic kept building up but i wasn’t able to scream until I woke up in a panic.
350,"I had a dream in which I was watching a movie with some of my friends, including people I had met from my training for a work position. My two friends were romantically involved and left without me, so I hitchhiked on a trash truck to get home."
352,"I recently had a dream that I was in the bed of a truck with a man without a face, but I knew that he had bad intentions and a knife. At this point, I was at a 1st person perspective. It was really dark and eerie, and there was a bunch of random dingy white cloth I was sitting around. It was night, and the sky was foggy and it kind of smelled like smoke, but the stars were still visible. The man brought from behind him this baby tiger with very bright blue eyes and he told me that I had to suffocate the tiger until it went limp or else he was going to hurt me. I was holding the baby tiger and just looking into its eyes for a while because they felt really alluring and like very lively. It was very cute, I was cradling it in my arms while petting it and I felt protective of the baby tiger. This was the only part of the dream that felt good. The man started yelling at me to do it, he was screaming very aggressively, and I was terrified, so I put one of the cloths over the tigers nose. It was struggling and squirming and I started sobbing because I didn't want to kill it so I took the cloth away and started running with the baby tiger in my arms. When I started running, it switched to a 3rd person perspective and I could see both myself and the man running through a large city with streets in the pattern of a grid. I kept trying to hide in alleyways and he kept finding me so I kept running. The running went on for what felt like forever. I went into a dessert store that was empty and hid behind the counter, but the man walked in looking for me again. I could see both his perspective and mine. I was breathing very heavily and still crying because I felt bad for the tiger and I was terrified but I woke up from the dream as the man found me behind the counter."
354,"I was on a boat with a police officer and a boy, the boy was crazy and ended up killing the police officer and his girlfriend on the boat."
356,"Recently, I have been stressed about my future, finances, and personal relationships. This dream reflected those fears. It was in first person, and the setting was vivid and realistic. I woke up in my bed, smelling bacon wafting from the kitchen. I couldn't tell it was a dream, but something didn't feel right. Unlike my room, there was nothing on the walls, across from my bed sat a small desk with a lamp, and the rest of the room was empty. My bed was hard, almost like it was made of cardboard, and I lay under a bright blue comforter and on a gray pillow. I heard a knock at the door. ""Come in"" I said softly, still unaware that I was dreaming. I looked up to see my father in the doorway. That was weird. I have not lived with my father for over six years at this point and have not spoken to him in four. I looked him up and down, he was older now. His hair grayed and his beer belly growing. He asked what my plans were for the day as if it were any other. This was the moment I realized I had to be dreaming, it sounded like him, and looked like him, but more similar to the image of him older in my head than reality. I asked him why he was here, and he said he didn't understand. I noticed his clothes, nicer than anything I remembered him wearing, and his hair was neatly trimmed. This has to be a dream, I thought to myself, feeling like it was all too real. I started to get emotional, bawling up and crying on the bed in front of my father. I felt fear, anger, loneliness, confusion, and most of all, wishing this version of my dad could have been reality. He came over to me, comforting me the way my mother always did when I was little. I wished he was this kind, this caring, but I knew it wasn't real, it couldn't be. I knew my father, and this man looked and talked like him, but was a version of my dad that cared. I started to get frantic, scared that this was a tactic he used to get close to me, deceiving me. Within the dream, I felt my body get hot, my chest get tight, and my fists ball up. When I looked up through my tears, the older version of my father was gone. Where he stood now stood reality, the narcissistic creep standing over my bed smiling at me as I cried. I screamed, then I awoke in my bed, at home."
357,"I was brought into work and told to sit down to talk to my boss, apparently I really screwed up and they said they would fire me and call the police. I ran out of my work at the hospital, and got into my car and then the police chased me but it wasnt normal police it was INTERPOL for some reason. I crashed my car on the run and that's when I woke up."
358,"A few nights ago, I had a stressful dream. I had straight hair, but my hair is naturally curly. I was trying to straighten my hair again because it was frizzy, but my friend Andrea wanted to do it. I remember her having a hot comb in her hand, but I was very hesitant to tell her that my hair would get burnt because it is not strong enough, or I don't have the correct curl pattern to withstand the heat of the hot comb. She told me that it would be ok and proceeded to do it. My hair is important to me because it is unique. My hair was burnt from the bottom in the dream, and I felt my heart sink. I was breathing heavy and didn't know what to do. Next thing I know, I see a lady with scissors behind me. The lady had brunette hair, and I know I've seen her before at Ulta. I told her I only needed the burnt pieces to be cut off and that my hair was originally curly, so if she cuts too short, my hair will shrink too much. I remember her cutting it too high, and I began to cry. I told her she did it wrong and that my hair wouldn't look right anymore. The last image I remember is looking in the mirror, having extremely short hair. This whole time, I felt stressed and cold. I was myself throughout the dream as well."
362,"This dream had no meaning. 

I was sitting on the couch in our living room watching The Simpsons (our meaning my family). We have 2 dogs, but they didn't exist in this dream. I was wearing tennis shoes, a t-shirt, and shorts. I was home by myself because it was Friday and I get home at about noon from school, and my family went to a store in a nearby city.

It was overcast outside, so the sky was gray and the air was pretty still. No movement from the trees and creepily, there were no animals outside. It had been probably 20-30 minutes since I got home. Then all of a sudden, the tv switched to the news and was talking about how people were urning into zombies and eating people. I tried to call my family members but none of them answered the phone. 

I didn't know if I should drive to them or not. I ultimately decided to stay home and hide. After about a week of chilling at home by myself, I went outside. It had only been a week and yet my whole neighborhood looked like it had been abandoned for years. Then my dream like fast forwarded and I was all of a sudden a nomadic person. 

I never found found or heard from my family and didn't know who I could trust, so I kept to myself. Like 3 months had passed and I was a seasoned vet. I had safehouses that only I knew about, I had learned multiple survival tactics, no matter how uncomfortable and unsanitary it was. I had also become desensitized to killing zombies and even had a few problems with humans. 

Then one day, I was scavenging a store when a little boy found me and asked if I could help him get back home. I asked where it was. He told me it was a college that he and his family took shelter at when everything started. I was thinking that this was going to suck since the college he was talking about was in a different city that was 40 minutes away if you drive a vehicle and take the highway. So this was going to be a long journey. 

Then my dream went fast forward again and we were there. We looked at the world a bit different now because we had survived many things like cannibals trying to eat us, raiders trying to take our stuff and leave us for dead, people trying to turn us into slaves, etc. We arrived at the school that I used to go to before the apocalypse happened. There were walls surrounding the place for security and they had guards who had spotted us and recognized the boy that I was carrying. 

We were tired, stinking, covered in blood and dirt, and we hadn't eaten in like 3 days. They opened the gate for us. I put the boy on the ground and both of us were hunched over and limping into the area. There were so many people there to see the return of this boy. Then we both started laying on the ground on our backs with our eyes closed and we both sarcastically said ""Are we dead yet? Please tell me we're dead."" Then the people started helping us up. Then my dream ended and my alarm woke me up."
365,"i recently blocked a girl i was best friends with. we were extremely close and i love her so much (platonically), i don't know why i did it but i feel so so guilty. i had a dream where she went on some kind of vacation with her family, and i wanted to make things right so some how i followed her. we were all on a cruise and i was sneaking between rooms, trying not to be caught. at the last second, as im hiding in the bathroom, she opens the door and sees me, and freaks out. i apologize profusely and try to be understanding of how she must feel, and she excuses herself because she's overwhelmed. then i wake up."
368,I had a dream that I was fighting my ex best friend.
371,My dream started with my friend being mad at me because I wasn't going to target with her but I don't remember how I found this out but then it switch to me being in a car with her and my other friend and my other friend was driving. I was in the backseat and we drove past this car going the opposite direction. I think our car kind of swerved into their lane but we didn't hit the other car. I looked back into the window and I saw the car had stopped and suddenly started reversing very fast at us. I started yelling at my friend to go faster because it was coming at us. It was so scary and I felt a sense of urgency but then I woke up.
372,"I was at my childhood freinds house after she had died, she's not dead in real life, and we were in her old bedroom sharing stories about her. her mom came in and got mad at us for being in her room then I woke up and it took a while to remember if she was really dead or not."
375,"I was playing a pick up basketball game with Darren Peterson, and we start to become friends"
385,"I had a dream that I woke up in my bed and my boyfriend opened my bedroom door. He is is basic training right now and I haven't seen or talked to him in three months, so the feeling I got in my dream was amazing. He came up and hugged me and we began to talk, but right as I was about to kiss him I woke up. I remember waking up and just feeling a pit in my stomach when I realized it wasn't real and that I was alone. In my dream it was almost like I could even smell him. Then I woke up and everything was gone. After an hour those weird and sad feelings went away."
388,I broke my old phone frequently and I just got a new phone. I had a dream that I was in a library and I reached for my phone and it was completely shattered and I had to tell my dad that I broke my phone
389,"In my recent dream, I went to visit my long-distance boyfriend. I remember walking around his campus and being in his apartment. I have vivid memories of being in a park. I remember feeling super happy and excited to see him. Now I'm not really sure how, but somehow my dream shifted really quickly to sadness and fighting. I remember going on his phone and seeing him texting another girl named Emily, and this led to a huge fight, where my boyfriend was extremely mean to me."
393,"i had a dream about my dorm, where i woke up and our window had broken open and popped ou,t and i had to fix the window and it was very scary and windy"
394,"I had a dream that me and my boyfriend bought a house together, and we brought the fish we got together about a year go, (true information) my pleco fish was huge, and jumped out of the tank, it was one of the fish tanks that's like built into a wood piece of furniture, sucked my boyfriends face, his dog who had just gotten a cyst removed from his neck tried to go eat the fish so I grabbed him because I didn't want him to eat the fish and accidentally ripped open the whole and has to permanently eat from a feeding tube. I felt soooo bad and was crying all around the house. A little later in the dream his mom asked why we already had a toddler room set up and I was extremely confused, so I called my sister and she came over to look at it with me, I then realized it was my childhood bedroom and my parents saved everything down to the art I had on the walls, and was saving it for my future child. I then cried and thanked my parents."
397,My point of view in my dream was first person. I was in a bedroom and it was dark but in a cozy way. There were white cozy curtains that didn't let any light from the window through and the walls were painted gray. I was under the covers and they were very comfortable and plush. The guy I have a thing for was there and we were talking. All of a sudden I was in the passenger seat of a red convertible and I saw myself from above. We were driving down a scenic road lined with trees that were changing as they do in the fall. I remember feeling anxiety at the point of being in the bedroom but freedom and thrill in the red convertible.
398,"The entire dream was in first person. I was in the French Quarter with my family looking through my grandmothers house after she had passed away. It is important to note that at this time we were on the second level of the house in a room  that was lined with windows on all four walls. It was midday, so the sun was shining through all of the windows. I had this immense feeling of comfort, warmth, and happiness in this room. Eventually, I had gone off by myself and had then found some type of secret passageway through the wall. All of the sudden I fell all the way down this dark stairwell and ended up in a pitch black room at the end of the staircase. The only light was coming from the crack under what looked like a door at the top of the staircase. I looked down to find that I was shackled to the wall in these extremely heavy chains. Once my eyes adjusted, I realized there were many people in this room that looked to be very emaciated, and they were almost pleading to be let out. There were these beings in the room that would come from time to time that looked very alien-ish. The best way I can describe them is those monsters called the Hollows in the movie Miss Peregrine's Home for Peculiar Children. Also, it is important to note that while in this room, I was filled with this overwhelming feeling of terror and hopelessness. I kept trying to escape but every time I would make it to the stairs I would be pulled back down the staircase by the chains that were shackled to my hands and feet. I genuinely believe this was some type of metaphor for Heaven and Hell or something alone those lines."
400,"My dream was from the first-person point of view for the entirety of it. I was in an unrecognizable neighborhood, waiting for my friends (real-life people I know) to pick me up so we could go to Worlds of Fun. I ended up missing my friend's time slot to pick me up because I was helping my dad garden at my neighbor's house. The next thing I remember was telling my friends that it was a good thing. I  didn't go because I got tests back from the doctor saying I had a cancerous tumor on my heart and liver. I started to feel afraid, and then I woke up very scared and wondering if I was ok."
