id,text
404,"I tend to remember pretty normal dreams, especially if they were inspired or based on something from that day. In my last dream (yesterday night), it was obvious I was somewhat a part of the video game setting that I had been playing all day (Red Dead Redemption 2), set in the wild west, it started with kind of a mission or thought I had to myself, saying I could only wake up in my bed when my alarm went off when I had earned the sum of 1000$, which in a video game set a while ago was a lot of money, sort of insinuating that no matter how much time passed when i was in the dream none passed in real life, I started my life in the game becoming an orphan, which was kind of my way of setting myself up for a solo mission, that happened in the form of my parents (who in the dream looked exactly like my real parents) as owners of some small house in a kind of forested area came under attack, I remember in my dream it was either natives or outlaws, I wasn't too sure as in one part it was outlaws coming in to ransack and loot the house and then at the same time it was natives who threw torches in, burning it down, either way It shifted to me the next morning understanding what had happened, and starting to pack up supplies for myself, ammunition, things for the horse, all of which where in game objects in rdr2, in the dream for some reason i was much younger, referring to the prompt and attempting to answer as accurately as possible there was no smell or taste, or even point of view, I was just simply in it, I never saw myself or anything from my point of view, there where a few more ""scenes"" where I sort of time-lapsed through growing up, shoot a gun from off a horse, and be able to shoot targets well, the last thought before I woke up was about robbing someone, and if I should morally do it since it was just a video game, or since it was so realistic I felt as if consequences in general, the dream sorted ended there, probably when I went into a deeper sleep as I felt as though I didn't wake up from the dream, either way Im not sure if it is notable to the research but I slept through my alarm for 7, waking up at around 11:30."
405,"I was trapped in my childhood closet with people banging on the door, sitting in a pile of clothes with light coming in through the bottom crack of the door I was a younger child again crying trying to be quiet and not seen or heard holding my breath to be invisible but the person on the other side melted and slid through the door crack to reform and stand over me and when i tried to run my feet were stuck"
407,"This dream was in first person. I don't remember much but I remember who was in the dream. I was on vacation with my family and our family friends that we go on trips with. Their son is my age.
I remember feeling very happy."
408,"It was a dream about my last football game. I remember not being able to run, feeling the pain of being hit and feeling the emotion of playing in a game. It was very realistic."
409,"The whole dream was in first person, and essentially my parents kicked me out of the house (or maybe sent me away?) To live with my friend on his farm. I was attending college but had no financial support but I had to work overtime on the farm. For whatever reason, everything was in the color range of brown, orange, yellow or tan. Picture a stereotypical farmhouse made of only these colors next to an expansive wheat field. I remember feeling something not dissimilar to sadness, near hopeless and despair but still believing I could make this new life work, just that it would be significantly harder."
412,I was in a car with my family and we went around a corner of a street and a semi truck was besides us on the opposite side of the road and when we went around the corner the semi truck flipper over onto our car. I saw it land on us and then I saw white and then I woke up breathing really heavy and sweating and I was scared.
413,I was sitting in the dining room of my sorority house at a table with a bunch of random people I did not recognize. The only person I knew was who was sitting to my right which was Nic from Love Island. I remember it being in my sorority dining room however it felt like we were in an insanely busy restaurant. I remember it being very loud with a ton of background noise everyone was talking. I felt a feeling of comfort because even though the room was so crowded and loud Nic and I were just talking to each other and laughing about the fact that some man had just came up to him and asked for a picture. We were sitting in the corner of the dining room and there were big windows behind us and it was around sunset time.
415,I was getting prepared for my upcoming clarinet jury and was about to perform.
423,I had a dream that I was with my first boyfriend Lance. He was trying to get back together with me and his mother didn't approve of it because she doesn't like me since he and I was on and off so much.
424,"I remember being at a house with all of my friends and people at my school, everyone was in normal clothes and everyone looked and acted how they usually do everyone was having fun. Later than one of my teachers started to act weird with me and was slowly trying to assault me while the guy I liked was talking to another girl. I asked him to help me get away from my teacher and he didn’t care and went off with the girl that was from my school as well. I was then later assaulted and never looked at the teacher the same after even though it was just a dream."
426,"I was sitting in the school library worrying about some assignment that was due soon. I was really stressed about it and my leg couldn't stop bouncing. I was typing on my computer and doing the work, but nothing would show up on screen."
427,"it was first person, I was looking for my dog with my family, I felt sad and scared."
428,"I decided to take a nap in my dorm room, which lasted for about 45 minutes. In my dream, which was in first person, I was braiding my roommate's hair, when her boyfriend walked into the room with his friend and his friend's girlfriend. My roommate and the other girl started arguing back and forth, so I decided to step out of the room and go on a walk because it felt tense and awkward. I ended up walking all the way to Mass St., but it appeared very differently in the dream and was almost unrecognizable. As I was deciding to walk back, I was interrupted by a Halloween parade where candy was being thrown. I could smell the sweet smell of candy strongly, when suddenly, I felt intoxicated. I remember I had nothing to drink/consume in the dream the entire time, so I was very confused as to why I was feeling this way. I decided to ignore the feeling and continue walking back, ignoring the parade that was happening beside me. Suddenly, I face-planted on the floor and a bunch of my classmates from my high school were standing on the other side of the street laughing at me. I was extremely embarrassed and annoyed at this point, so I started walking to a safety point, which ended up being a warehouse. On the way of walking to the warehouse, I was almost ran over by about 10 semi-trucks in a row on the street. I was extremely startled by this, so I ran into the warehouse afterwards. Once I got inside, I realize that all of the semi-trucks were being shipped out from this warehouse and I felt as if I was being crushed inside. I felt a rush of panic, so I ran into the first empty space I saw in the warehouse. However, as I was trying to escape, the room continued to expand and there was no point of escape. It felt like I was in the backrooms and was running around in spirals. I decided to call my roommates and my friends, but nobody would pick up, so I turned around and went up a staircase, where I was met with a man. I shouted at him and pleaded for his help, but I was met to my surprise when he turned around. He had a severe case of scoliosis and kyphosis, along with having an extra pair of legs that were attached to his original legs. He agreed to help me out, but bombarded me with several questions before he let me leave. I was feeling very uncomfortable at this point, so I told him I had to leave. He suddenly got aggressive and pinned me down to the staircase with this 4 legs. I was immediately put into psychosis and I saw 4 images appear one after the other. It looked like a video game screen, the first image was telling me about my past, the second image was explaining my present, and the third image displayed my future. I felt extreme discomfort, like a heavy stone was pressing on my chest. I was unable to move an inch of my body, as I was laying supine from the floor with my head to the ceiling. I also started floating in the middle of these images appearing. The last image prompted a question of asking me my wishes, and he offered to grant them for me. I immediately snapped out of the psychosis and told him that I did not like this at all. After this, I woke up in a panic with a racing heartbeat and sweat dripping down my body."
432,"I was brought into a School that looked like a castle i was there with a group of people I didn’t know that specific group of people. We were given a tour then we were brought to a room some people from my high school showed up in army uniforms then they were taken to a room i ended up in the room with along with my mother, grandmother, and brother they were planning on stealing from the store, I remember feeling nervous about my brother being involved and at risk compared to the rest of us. I said I didn’t want any part but my mother said we need to then we could leave so I participated. I remember the store looked like the inside of hobby lobby but with items that were more valuable like jewels and i remember a row if dolls houses and thinking if we had the room i wold rather take one of those but we didn’t have time i tried making it quick but my family were taking to long i remember becoming irritated by having to wait. I was sitting in middle of the isle with my mother, and grandmother when i made i contact with a worker and older white women an i just new she new i felt my stomach drop but nothing happened my brother came over and said he needed to use the restroom and left it was a straight view of the bathroom there was a water fountain next to it I remember being switching point of views were my brother was in the restroom and found a note I don’t remember what was on the note though. Then i was taken back to my point of view i fell scared i was ready to wake up when it went black and i heard loud bang by the restroom my brother was in they it was like the swat team went in it i remember thinking that’s my brother in there then i woke up started and couldn’t go back to sleep."
439,Friend got into a fight
442,"In my dream I was in the Budig 120 lecture hall and i was being chased by a random girl that I didn't know, but I knew she was trying to kill me. I was scared and ran for my life jumping over the chairs on the upper level of the auditorium. I remember losing my shoes which were my brand new birkenstock clogs. I ran out of the doors eventually losing the girl, so once i knew she was gone i ran back into lecture hall and grabbed my shoes. I remember feeling an intense fear/ adrenaline rush when being chased by the girl and being very relieved when i lost her."
443,"i was just haning out in a neighborhood that awake i dont know but alseep i knew it because i had lived there for a while, but i go to this party its blue in there , people are drinking smoking dancing smilling and then i feel my right hip get hot and wet, i was shot and then i was shot 9 more times but it didnt hurt it was just numb and tingly"
445,"I recently had a dream where my step dad passed away. I remember being at the funeral and holding my mom hand, while comforting my little brothers. I remember feelings of despair, sadness, and grief. The funeral home was quiet and dark with stained glass windows, with the feel of a church. The majority of the dream was first person, until I gave a speech and it switched to third person."
446,"In my dream I was in a bar not too far off campus, it was loud and lively. Everyone was dancing and hanging out with their friends. I had too much drink and began to get dizzy and I couldn't focus like normal. I remember there being a boy who was around me the whole night, he confessed how he felt about me. At the time I wasn't sure whether what he was saying was the truth or if we both were just impaired."
447,A past coworker and I crossed paths at a coffee shop and they confessed to having feelings for me when we worked together. Since I've been away at college he was able to move on but seeing me in the coffee shop rekindled the feelings he was having and he wanted us to go out together. I was feeling shock and didn't know what to say to him. I told him that I would like to go out but I needed a little bit to decide how I felt about him. Him and I were good friends so it was strange to hear him say all these things about me.
459,"I have very mundane dream scenarios, but I always see very vivid color and I can experience sensations like taste, smell, touch. I had a dream where I was looking through an old abandoned mansion with a team and we had only flashlights. It might have been an abandoned museum because we saw items like dinosaur bones and other artifacts. I see my dreams through a third person perspective, like looking at a movie, but I'm also commenting on it, describing what it was like do be in this scene. So many times while my dreams are happening, I have an inclination of what's going to happen already."
460,"I was in a greenhouse directly from the set of Harry Potter. It was a dark and stormy night, which made the glass walls fog the outside world. I had an uneasy feeling as I was alone in a greenhouse full of weird plants. All of a sudden, I heard a dementor's scream (a flying creature from the Harry Potter series that sucks the souls out of its enemies) echo through the greenhouse. I instinctively ducked under one of the tables as the room began to freeze over. As I looked around, the shadow formed in the far window on the right. It slowly crept closer to my position and began to grow taller with each step he took. When he approached the window directly to my right, I saw the face of Voldemort (the main antagonist of the Harry Potter series, very scary-looking). He made eye contact with me and screamed with laughter. The glass shattered all around me, flying inches past my face, and Voldemort began to advance. I struggled for a moment, then screamed. Then I woke up."
464,All I can remember was that I was pregnant. And I was bad at taking care of the kid and was scared of what to do.
465,"In this dream, I was holding hands with someone I really liked. I remember the feeling of his hand feeling very real and that I was looking at our hand interlocked. We were walking and talking on a sunny day in a courtyard. Seemed like a fancy mansion courtyard where a lot of people were around us, They were walking and talking in their own conversations. Me and the guy kept walking and eventually stopped when there were a group of people wanting to talk to him. Not much I can remember after that."
468,It was first person. I was at school but it wasn’t quite my normal classes. I wondered around trying to get places and talking to friends. But there were friends there with me from my hometown.
471,I don't remeber much about the dream but i do remeber that I just bought this really nice white jacket a few days ago and I picked it up and it had a huge red splotch on it. I then thought wow this looks exactly like the reel I was watching a second ago then I woke up.
472,I was on a run and I stopped at at stop light and a car ran into me and I went to the hospital. My family came to see me then I started to die and then I woke up.
473,"n a big super market like a big Walmart with my sister Alex and all of a sudden a loud voice speaks to us about the groceries we were buying and everyone in the store was confused and everyone was scared. Next thing we know like five min later while we were checking out at the self checkout the same loud voice said something about hoping we enjoy something we’re buying and then saying, anyway this planet is MINE!!. And then a loud grumbling began and these minions of the boss started crowning the store and killing the people inside."
474,"I had a dream that I was able to get the Lenox Spice Village set, which made me immensely excited and happy."
476,I was in a baseball fiedl playing but I was a small kid and then din asourds attacked everyone and I was the only one alive then I woke up
477,"I dreamed that my ex and I were sitting in a field and talking about trying again and about how things hadn't worked before. It was just a super long, drawn-out conversation, and we were sitting under a tree, and it was just super peaceful. My ex is an athletic young adult with brown hair, and I am a young girl with light brown or dirth blond hair."
480,"It started off in a very busy very noisy bar, the bull outside section, with purple and blue strobe lights going off in a very dimly lit area. I was staring at my phone screen and was trying to coordinate a motorcycle deal in the middle east because I was working in intelligence for the government. The phone was not very vivid but more just a haze of light and I held it above my head. I then met a woman with a blonde bob haircut on the street who I knew was in relation to the motorcycle deal but seemed to be a conspiracy theorist/crazy. We walked down a street that looked like the end of Massachusetts street and 6th street in silence because what we were doing was ""bad"" and it felt tense, it was still dark and felt cold. She said she was being followed and I thought we weren't because she was crazy but agreed with her to be nice. I turned around as we were walking and a blob of a figure was walking behind us but it seemed like regular foot traffic. i turned around again and it was a black horse sprinting at us and i got really scared. I started hitting it and it held up its arms and threw blind swings back at me with closed fists as it was a man now. it felt really intense. Then it felt like that awkward point in a fight were your both to scared to fight so you step away and just start yelling and it was Bradley cooper in a bucket hat with a cut lip. He yelled that he wasn't following us but was just running. the he was holding a fishing pole with a hook on the end of it next to my neck to where I would know that if he ripped it it would catch my neck. Then I was holding a fishing pole next to his neck and I yelled back that he was getting too close and it looked like he was chasing us. I was panting and felt startled and embarrassed. Me and the woman kept walking and walked down some stairs to a bathroom that was the foyer with a door on one side. there was another person who felt like they were with us the whole time. The person sat on a counter just across the bathtub and there was a linoleum floor made to look like wood and was lit by yellow light. Me and the woman got into the bathtub and she morphed into my girlfriend. I felt really guilty I was with another woman and felt almost like i got caught by my girlfriend. Then my roommate from freshman year came in and tried to get into the bathtub with us and i had to push his head away and say ""no roger no"" kind of the same way you would with a dog. He was wearing jeans and a white shirt and his felt black and greasy in-between my fingers. both me and my girlfriend laughed each time he tried to get in and it felt very funny."
482,I met some family when I was with mine and they had three daughters and a big house with a huge pool and basically I just talked to the dad the whole time.
484,I went to a drake concert with my friends had a good time and went home with a girl
486,"I was at a forest covered summer camp with people from my high school and at the time guy I liked. We were all having a good time everyone looked the same but the inside of the cabin was very interesting and definitely run down, kind of like the scene of the lost boys from the movie Hook. I then saw the guy i liked with a different girl from our school which made me very upset. Later on on of our teachers became a killer and was trying to find me throughout the house and when I asked for help from my friends while they were playing dodgeball no one helped me and then i was later sexually assaulted by my teacher and then I woke up."
489,I had a dream that my friends and Ihungout in my dorm and listened to music.
490,"This was the most recent memorable dream that I had, and it was my girlfriend's and i's wedding"
493,"I had a dream where I went home over Christmas break and I was in a playground with two random kids, one very young, like maybe 8 months old, and the other one was maybe 7 years old. There was a sort of school shooting or at least a terrorist attack. It was not very scary; I did not feel like this was really happening while I was sleeping. At some point, there was a rollercoaster, and we went in there,e but then we heard gunshots again and we had to run. Then we found a campsite with people who could help us. All the time I was carrying the young kid. I made me feel like I was a hero in my dream. I was not scared but it also did not feel very relaxing."
494,I had a dream that I went shopping with my friends and i saw someone random from highschool and i was just hanging out with friends in a dream.
496,My boyfriend threw up on me and i started crying. i hate throw up
497,I recently had a dream in which it was real life but I was Tinkerbell and the course of the dream was the exact plot of the first movie. I could not taste or smell. The people in the dream were those I see in my day to day life who were also fairies! It was a mixture of first and third person but mostly third. It was a funny and funny dream.
502,The dream was me coming back home to swim with my club team. I went over to the area right outside the locker rooms to see my best friend and give her a big hug. I was so excited to see her. But then I look to the side and these girls were judging us that we left back home. These were girls that I had struggled with before I left for college. They were always rude and held me to a higher standard than everyone else so it hurt.
505,"I rarely have lucid dreams, and I don't think I have ever truly experienced one. My dreams feel almost like words and ideas being displayed in a flash and sparking emotions within me. My most recent dream was of my ex-partner telling me he no longer wanted me and was moving on. I saw only his face, although no words came out of his mouth, I knew what was being communicated to me. I had this image of me running, trying to catch up, although it was very abstract and colorless. I felt sad and abandoned and woke up teary eyed."
506,"My dream was that there was a hurricane coming, and my dad and I had to evacuate wherever we were. We had to rush to put up window covers and pack the car with all of our stuff. I kept trying to pack my most important things, but every time I would bring stuff out to the car, I would forget something else inside. The sky was growing darker, and it was getting windier. My dad was moving slowly, too, and we had to stop for gas and to go to the grocery store. I remember feeling very stressed out that we would not evacuate in time. There were palm trees, but the surrounding area was somehow landlocked. The grocery store was a publixs. The town we were in was a little bit run down but not anything falling apart."
507,I was back in my old high school as a librarian.
509,"I was in a room unrecognisable, I was around my senior year of high school class. I saw Jesus Christ and I remember seeing His bright green eyes. I kneeled before him and started crying because I saw the eyes of my God."
510,"I was at work, with high school classmates as my coworkers. I love working and was having a good time, joking around. A particularly angry customer came in, and due to that I closed the store because I was worried the customer would hurt one of the employees (not sure why or who). I was feeling protective. After I closed, I was in my own home and my previously mentioned coworkers began sexually assaulting me. I was terrified and enraged, trying to fight back and doing whatever I could but it was no use. I woke up extremely afraid and uncomfortable."
511,"In my dream, I was watching a person who looked like me trying to steal my life. It was at a house with a pool in the backyard, and next to the pool iw where my clone and I got into an argument because she tried stealing my boyfriend in my dream."
512,"It was in first person, and this guy, Jacob, tall, lengthy, short (slightly grown out) brown buzz, I think I was outside in a park and he walked up to me and asked if I wanted to go on a date and I said yes and we hugged and then held hands and then i woke up"
514,"First person view, at a friends house the morning after a party, it was dark in the house but the light was coming in through the blinds, it smelled like dust, sweat, and a light scent of beer, I was talking to a guy I was with the night before, we were both hungover, I don't remember what we were talking about, but we started kissing, and then we ate food and then the dream was over. I felt happy, excited, and blissful."
518,"I dreamed that I was in my room and laying in my bed, when a huge spider dropped down from the ceiling by its web. The spider was black with yellow spots, and the web it fell from was white and long. I witnessed the dream from first person POV and it made me feel very afraid as I have a big fear of spiders."
529,no
