id,text
2,"I had a dream a few nights ago. I was walking around campus with this one guy I like, just chilling, holding hands (I could feel that). We walked past murphy, then over to ISB to hang out with some of my friends. I remember at one point I got ahead of him and just stood there, arm stretched out back to him to get him to rush forward and catch up. Once we were with friends we just sat and hung out, we were also dating in the dream. Lowk it was a fun dream. Emotions represented v well, top tier yearning."
6,"I was dreaming about where I was a little kid driving to where my parents work. Along that dream, we did very random things such as drive a monster truck that was red, looked at animals but wasn't at the zoo, overall felt like I had no control just because that I was a kid and whatever my parents say went. I felt the emotions of confused but joyous throughout. There wasn't really a plot that I remembered."
7,"It was in third person and me and my friends were in a dungeon. It was dark and water dripped from the ceiling. Moss covered the walls and bars we could hear the wails of others around us. I could see the shadow of my best friend in front of my cell. Her face illuminated by candle light set at intervals along the hall connecting each cell. The head of this evil organization appeared and told us that if someone ate poison the rest would live and be set free. So i decided to eat it. However, he lied and no one was allowed freed. This made us so angry I magically recovered and I broke through the bars of my cell in the middle of the night and set everyone free then set the dungeon on fire. We all ran through the forest away from the flaming building our path illuminated by moonlight."
8,"Me and my two roommates were in an apartment building and the guys living a couple doors down some how broke into our apartment. They only left a note. Then they kept doing it, then I woke up."
10,"My dream was about my roommate. She got up and went to sleep in the living room, and took our nightstand with her. The environment was our dorm room, and I felt stressed out because I didn't know why she was mad at me or if she was mad at me. It was first-person point of view, and it stayed the same over the course of the dream."
12,"I had a dream that I was at camp with my friends, and we were participating in the typical camp activities. It was a very happy and nice dream. I felt happy and nostalgic, it was from my pov and it was very close and personal as if I was there."
13,going to a concert and then being left behind it wasnt detailed and blurry
17,"I remember a desolate wasteland, I could feel heat, and smell smoke, I saw shadows darting around but could not make out any physical characteristics just walking shadows darting past me. I felt anger, just intense rage."
23,A dinosaur picked up my families minivan with my entire family inside and started breaking it. It was dark and stormy outside and we were in an abandoned trailer park. It was third person point of view. I was very scared and crying.
26,I had this dream about that I had slept through my class and I failed it and my parents got really mad at me.
28,"I have a vivid dream every couple of weeks about tornadoes, specifically about hiding from them. The most recent took place in a school where every wall had a window so there was no where to really hide. Me and a group of other girls had to find our way to the gym, the only place in the school with no windows. The problem was that we had to go through a big door, then a tiny hole in the wall to get in. We barely made it because we kept having to stop and drop for cover because there were at least three tornadoes. In the dream I was very anxious that I wouldn't make it into the gym in time. I was also stressed because no one was taking the tornado seriously, and I was the only one hiding, everyone else was just going on as if it were a pointless drill. The interesting part about these dreams is that I'm from Colorado, where we never have tornadoes."
29,"It was a nightmare that I was being kidnapped, I remember looking into the mirror of a run down bathroom and my face being especially my eye being black and blue. I ran out side of the building and remember the feeling of like wind on my face but always feeling like someone was behind me. The dream repeated twice until I was hidden on an airplane and then guy who was trying to find me ended up falling out of the airplane and I woke up."
34,"First person POV, on a date with the person I like. I felt really happy. I could hear just normal background noises as if it was real life."
35,"I had a dream recently that stuck with me. It started with me sitting in a classroom, waiting for my grade on a big exam. When the paper came back, 'F' was written across the top in red. My chest sank, and it felt like everyone else in the room knew I had failed too, even though no one said anything.
The scene shifted, and suddenly I was walking outside, but the world felt heavier than usual. It was cloudy and damp, like it had just rained. My shoes splashed in puddles as I walked, but I didn’t have anywhere to go. In the dream, failing that class meant I had dropped out completely, and I knew I hadn’t passed my OAT either to get into Optometry school.

Eventually I ended up sitting on a curb in the city. Cars and people moved around me, but it was like I wasn’t really there, no one noticed me. I felt empty, like I had lost everything I had worked for. The whole dream stayed in first person, so it really felt like I was living through it.

The strongest part wasn’t the images but the feelings: shame, fear, and a sense of being stuck with no way forward. When I woke up, I still carried that heavy, unsettled feeling for a while."
37,"My dream was in first person view. My two friends and I were at a house but there was a smaller house across the woods where we had to keep our clothes. I remember we walked through the woods and went to the smaller house so we could get our clothes, but when we got there we realized something was wrong with the house. We felt unsettled and I woke up before I could find out what was wrong."
40,"I had a dream where I was with my friends playing pickleball. I remember it in first person, as if I was really standing on the court holding the paddle in my hand. The court was outside, and the ground was a faded green with white lines that almost glowed under the bright afternoon sun. I could feel the paddle’s rough grip against my palm and hear the sharp pop each time the plastic ball hit it.

My friends were laughing and cheering, and their voices echoed in the open air. The smell of freshly cut grass carried on a light breeze, mixing with the faint rubbery scent of the pickleball itself. I could see my best friend across the net, smiling as they served the ball with a quick flick of their wrist. The yellow ball spun in the air, and I felt a rush of energy as I stepped forward to return it.

The dream felt light and fun—almost like time slowed down so we could enjoy it longer. Even though it was competitive, there was no stress, only excitement. I felt connected to my friends, as if we were all on the same team even though we were playing against each other. The emotions were a mix of joy, focus, and pure enjoyment.

When I woke up, I realized that the dream showed me how much I value spending time with my friends and how sports bring us closer together."
43,I forgot to turn in an assignment and nothing was letting me submit so I felt really stressed out and anxious.
45,"I got into a car accident years ago with an ex-boyfriend and got PTSD from it. In the dream, I am riding in a car with my sister, her boyfriend, and that ex-boyfriend, and we are driving around my grandparents' lake house (windy roads surrounded by trees). We are having a good time. I cannot remember what happened next, but suddenly we are in the water with the car, but not sinking, and I can see the car I wrecked also in the water, but further away, and also not sinking. This is a recurring dream."
46,A recent dream I had is a dream about me and friend getting in an argument and people from my family showed up.
47,"The point of view is first person. I was from a different planet that was purple and orange. This planet was dying, being attacked by giant grub worms, and going into a black hole. I had a twin brother (13 years old), who had brown hair. We had a dog. Both me and my twin brother had the ability to fly, turn invisible, and fire powers. Our parents wanted to save us from our dying planet so they sent us to live with our grandparents on Earth. We were very sad about leaving our parents, but knew it was the best for our safety. We were sent via spaceship and landed on a playground on Earth that our grandparents live close to. None of the kids on the playground reacted when our spaceship landed on their play set. Our grandparents arrived at the park to pick us up and warned us that the Grinch lives on Earth and that his only mission is to find us and kill us. So our job is to blend in with all the other kids and pretend to be normal. However, at school one day, a group of kids see me and my brother turn invisible. So we have to tell them our backstory and they agree to help protect us from the Grinch. On the last day of school, it is dark and stormy. Me and my brother are the only two kids in this specific classroom. We hear a creepy laugh coming from outside of the classroom door and it opens. The Grinch, with a Christmas hat, stands in the door way and says, ""I'm gonna get you!"" The end. I was very scared at the end of this dream. I woke up at the very end out of fear. However, it was a very enjoyable and long dream to be a part of."
48,"First person dream of spotted lanternflies, an invasive bug, invading Lawrence. Except some of them were cybernetic and gigantic. Then for some reason they had a form of cordyceps and so we all hunkered down in the pretzel factory on the edge of town. Then my dream got interrupted and I was remembering details about protocols for my bacterial genetics class, unrelated. I remember being scared of what the bugs would do to the landscape but I had a flamethrower so it wasn't too bad and was more amusing than anything else. It was sort of the vibe of Fallout New Vegas or The Day After or Starship Troopers. I'm infamous for not being scared of bugs so it was more so about how destructive they were to the city."
49,"I was kidnapped, i remember looking at myself in the mirror almost black and blue like i had been beaten up. I kept running away but then it was like i would wake up and be back in that bathroom looking at myself again black and blue. It went like that until i ran away for the third time and then i somehow ended up on a plane and the guy who was chasing me fell out of the plane. I woke up finally but I felt like I was falling."
52,"I was on a sidewalk, winding down a steep hill lined with trees. I was laying on the ground with my comforter from my bed wrapped around me, trying to nap. Eventually I was unsuccessful and got up, walking back up the hill with my comforter in hand. A man approached me and grabbed the comforter from my arms. I cared lots about it, so I grabbed it back and pulled at it against him. I tried to scream for help but was unable. My voice hurt and I struggled to communicate anything. I was stressed, upset, and speechless. I woke up immediately after being unable to scream and was anxious."
54,"I had a dream someone I used to be really close to was trying to connect and catch up late at night during a camping trip. The people in my life currently who I'm close to were also in my dream and it was a continuous back and forth of seeing the old friendships/relationships and the new friendships/relationships. It was first person, and everyone looked exactly how they would in reality. I felt sad, but happy to see some of them. I felt like I missed them."
55,"In this dream I start off in my old house in nebraska and then me and my uncle go outside and there is a woodsy area and out comes a wolf, wolves are now chasing us back to my house, we end up going into the house and close the door. By the garage door there is my pantry and my uncle starts getting a snack out of the pantry and while he is doing that the wolves broke through and start eating me while my uncle eats snacks in the pantry. This is in 3rd person I belive and I was really scared."
56,I had a dream I was watching this baby that was the cutest baby I have ever seen. It wasn't mine but when I went to take a picture of the baby it turned into a toddler through the camera lens. It was weird but I do remember how cute it was.
58,The last dream that I can recall was just the other night I for some reason was laying with my boyfriends best friend rather than my boyfriend and the best friend started trying to do stuff with me so I got up really fast and laid with my boyfriend because I obviously didn't want someone else touching me and I was  really apologetic to my boyfriend because what the heck was I doing laying with his best friend. I would never do that in real life so it was a really weird feeling of guilt that didn't really happen.
59,"I had a dream that my roommate was in an insane asylum and her mom put her in there. We all went and visited her. It was dark and had one open room almost like a library. The rest of my roommates were with us. It was in first person. I felt happy seeing her, but sad that she was in there. I was mad at her mom for putting her in there."
60,I was walking home from the bars with a group of friends and then a van cornered us so we ran in other direction but car blocked that too and they took us in the van and had us work and give us a drug so nobody remembered where we came from besides me and they worked as mindless robots but I got out
61,"I was in my backyard setting up for a wedding. It was a warm and sunny day. I saw my mom, sister, and celebrity Chris Briney. I was in first person view. As I was setting up for the wedding Chris was upset because it was his wedding and nerves were getting to him. I told my mom about what I saw and she stopped the wedding. I felt nervous and anxious about the wedding."
68,"My dream was that I was having a sleepover at my boyfriend's house. I was very excited because we do long-distance, but all of his college friends were over, which I did not know about, and caused me to get angry. I was lying in his bed waiting for him to come into the room so we could go to sleep, but instead, he kept hanging out with his friends and ignoring that I was there. They were all playing video games in the living room while I was on my phone. My point of view was first person the entire time. Feeling ignored caused me to become very sad, upset, and annoyed. Eventually he came into his room and asked why I was upset and I said ""you act like im not even hear, you are always going to prioritize them""."
78,"I had a dream the frontal halves of my two front teeth fell out and revealed a bunch of pores within my teeth. I don't remember the setting I was in, but I do remember I was doing something normal when my teeth fell out all of a sudden. It felt extremely weird, even worse when I saw the state of my teeth. I started stressing and freaking out because I take pride in my teeth and oral health in general and my teeth just fell out. I wouldn't say I have trypophobia, but in this dream I did. I remember I could feel the pores within my teeth too, and I hated the feeling. I was squirming and trying to figure out how to fix my teeth. Then I woke up and felt weird."
84,"In my dream it was first-person point of view and I was on KU campus on the small parking lot outside of the north Stouffer dorm building. It was a sunny day that had spring vibes because the weather felt fresh not hot and the grass around the lot was fresh and green and it felt great in the dream I thought it was a nice day out. I was walking to my car a navy-blue BMW sedan that was parked 3 cars away on the furthest left column while holding an envelope, thinking about the tag I needed to put on my car. My mom was standing next to my car when I got there towards the license plate she had her curly hair in the bun with a neutral expression and was wearing a gray t-shirt, black shorts, and her black heydudes. Once I got there I talked and joked with my mom while opening the envelope, the words were more like how the adults in peanuts sound but I was very happy to see her and talk with her. In the envelope was my car tag sticker for the year on a white sticker sheet, it was bright orange with random letters as the date my mom helped me put the sticker over the expired one that said September 30 2025. Once the task was completed I felt relieved and the dream ended by my view dissolving into black and me waking up still feeling the same way."
91,It was in first person and it was my birthday. I woke up and went down stairs and my mom told me happy birthday. I went on my phone to see if I had gotten any messages from my friends or family but there was none. Turns out that everyone forgot my birthday and i woke up feeling sad.
93,My college roommate and I went shopping at a thrift store.
96,"What happened was, i was in my house that i currently live in on campus and i was walking up to my door when this deranged man approached me really fast. I remember being really uneasy about it and like i was running out of time to open the door. This was all in first person but then kind of switched to third person. It was a sunny day and the trees were swaying. So anyways, I was on my porch about to open the door when he showed up and then he started asking me a bunch of questions to which i cant remember but i do rememeber looking directly at his face and noticing that his pupils were super dialated and that he was probably on something. And thats when i started feeling even more uneasy. all of a sudden this little girl and boy appear next to him asking if i needed help in a non discreet way and so i whispered to them to call 911 and they did but the man saw what i was trying to tell them i guess and then he attacked me. I have never been more scared in my life then at that point in the dream. He managed to tackle me through the front door and basically harassed me and some other stuff that i dont want to talk about. The cops finally arrived and my family was there some how and so i started to feel less uneasy but then they barely did anything to help me and then i woke up."
97,The latest dream that I experienced was my boyfriend cheating on me. I don't remember exactly what it was like; I just remember feeling very upset and hurt. I had a pit in my stomach and felt almost nauseous.
102,"There was a massive spider in my shower and it was as big as me when i got close to it but when i stepped back it was regular size. I was trying to kill it but it wouldn't go away, and eventually when i tried to kill it when it was small it lunged at me and i ended up waking up and jumping back because it was so vivid i thought it did lunge at me."
107,"I was with my boyfriend, and we were in a room just making TikToks. I remember one we made where I pressed the button to start the video, and we went far back and showed our outfits. I showed my first, and then he showed his, and then we hugged at the end. The video only lasted a couple of seconds, but it was very fun. were just enjoying each other's company, and I felt so happy."
108,"I had a dream that took place on the beach with my ex boyfriends mom. We were celebrating something because there was party decor everywhere, but I am not sure what. My mom was there too and was in the kitchen working on the food. All my brothers were there playing football too. We were talking and all catching up until a big storm hit the house. There was lots of commotion, and then we all disappeared."
110,"I recently had a horrible dream where I experienced sleep paralysis. In this, I could not move at all or scream or yell no matter how hard I tried to, the only thing I could do was look around my room. The room was pretty much pitch black with the only light being the dim moonlight shining through the window directly to my left. My room is a square layout with 4 walls, and when you walk in through the door, my bed in the top right corner, my dressers and guitars are in the top left corner, and then my closet, tv and night stand are on the middle of the wall where the door is when you walk in. I was on my bed in the top right corner, laying there paralyzed, and trying to scream as I felt the most intense fear I have ever felt in my life. It was an extremely surreal yet confusing feeling, and there was a very tall shadow figure standing right in front of me on the bottom right corner of the room. The shadow figure had no distinct facial features or anything, just a 9 foot tall shadow standing there and staring at me. After about 2 minutes of this which felt like forever, I suddenly regained my sense of movement and woke up in an absolute panic."
111,"I had a dream that I was working for a Christian organization that was analyzing how people functioned in society based off of what brought them the most purpose in life. These religious researchers had concluded that everyone felt the need to have some other life form rely on them for life. Some of the things people chose to place their value in taking care of were: children, plants, animals, society. I felt confused by this information. I was taken through houses that represented how the different lifestyles of people lived. In this dream I was touring the buildings with a middle-aged, white bald man that I know from my workplace, and my friend's brother who I supposedly was dating. During the dream I felt like the researchers were crazy and I was judging them."
112,I had a dream about a man breaking into my house
113,A man broke into my house and tried to kill me
115,"I was sitting in a diner. I was in a booth with bright red plastic benches. In front of me was a guy from my work whom I also had a crush on. We were having a conversation when all of a sudden he got up and walked through the double doors to the kitchen. I remember being able to see his head through the circular windows walking away. I was waiting, but he never came back. Eventually, a group walked in, and 2 guys sat in front of me, taking up the space the original guy was in. The diner was full, and it was no other seats. One of them was studying from his religious studies class and ended up asking me for help. I remember feeling better around this guy than the original guy. Then I woke up."
117,"The last dream I remember was about a close friend from my home town. It was kind of a weird dream... Basically, I was going to the bathroom in a public restroom and I remember looking through the crack of the stall and seeing my good friend. I remember feeling very excited when she noticed me as well, but for some reason we could not speak to each other. She waved at me and I smiled. I think during the dream I thought it was rush week, and this friend is a year older then me, therefore she was already in a sorority and could not talk to me because of ""dirty rushing""."
118,"I am at home, but my house is in the forest surrounded by deer and a river. The deer are drinking water from the river, and there are a lot of flowers around that I could smell in the dream. I feel calm and happy during this dream. There are also butterflies on every single flower that surrounds the river. All I do in this dream is just sit on the porch and watch the deer and take in the view. It is a perfect day and it is very sunny. I am the only one in the dream, and I am seeing this like I am actually in the forest. I feel very happy and not stressed in this dream."
124,"It was a dream about how I captured a cockroach and give it a piece of fish to see if it would grow. It ended up growing too much and I had to put it into a Tupperware container, and it expanded and eventually exploded out a bunch of maggots all over the yard. I had to end up trying to avoid them and trying to get rid of them. Then I woke up. It was pretty scary and intense."
125,"Going to a football game with my girlfriend, not being allowed in, it smelled like popcorn and burgers, then going home and watching movies."
129,"First-person dream following my own perspective. I was coming home to a party at my boyfriend's (Sebastian) apartment. Three friends were already there, and Sebastian was not there yet. The three friends, Kennedy, Vicki, and Hannah, helped me pick out an outfit for the party, and it was a navy midi dress with ruffles. We all got ready together, doing our make-up, hair, and other pre-party activities, such as sipping a glass of white wine. Sebastian arrived home from work, wearing his police uniform. We went into the bedroom, and my friends left to decorate the apartment. In the bedroom, he got ready for the party, and we had some alone time before a lot of people came. When we were both ready, we walked out of his bedroom, and the apartment was beautifully decorated, and there was fancy sushi on the table for everyone to snack on. But the sushi was abnormally large. We played lavish games and drank prosecco, and I remember a lot of laughter and just a content and joyful feeling. And I woke up after that."
140,I had a cool dream where I was walking on a hiking trail with my family and it was like a nice rainy day.  As we were walking we say a few deer and and watched them and it was super cool adn we were all excited and happy.  Then soon after I woke up.
