id,text
141,"I had a dream that I was at my neighbor's house across the street, and they had like 100 TVs all over their living room to watch football. There were at least 6 people there, and all were in football attire. I was viewing the dream in first person and sitting on the floor of their living room for a few hours."
144,"I was showering in the bathroom of my childhood bedroom, I thought I saw something but brushed it off and stepped out of the shower. I then looked back inside of the shower and saw a man holding onto my shower head with his chest against the wall looking back at me. He stepped out of the shower and I was just standing there screaming help me over and over again while he laughed at me and just stared at me (he was then facing me). I than was downstairs in my dads office yelling at my father because he did not come and help me when I was yelling. I felt hopeless and mad. The man than walked down the stairs by my dads office and was tip toeing (even though it was the middle of the day and we could see him) and than I just got really confused."
145,"I recently had a vivid and unsettling dream. At first, everything felt normal and cheerful. I am working on a biology assignment that required me to find a remote location in the forest. The place was described in a photo, a cave entrance marked by two bear statues. All I had to do was take a picture there as proof.

When I arrived, the atmosphere suddenly became gloomy and heavy. I found the cave and took a quick photo, but then I noticed a group of suspicious people inside. Instead of leaving, I felt a strange pull to step closer and see what was happening. To my horror, I realized they were part of a human trafficking group. My heart pounded, and fear rushed through me. I tried to quietly back away, but they saw me.

I ran as fast as I could, jumped into a passing vehicle, and called the police. I remember feeling a mix of panic and determination. The dream ended vaguely, but I think the authorities caught them. When I woke up, I still felt uneasy, it was both realistic and terrifying."
147,"I had a dream I was sitting in a cottage looking house in a kitchen with baby blue walls and an island table with the actors from the Gilmore Girls, and we were sitting around the table, and I was trying to explain to them why I didn't like the show. I was in first person the whole time; it seemed very real. In the dream, I was trying to tell them why I didn't like the show without offending the actors because, for some reason, I felt like they were both the actors and characters from the show, and I felt really bad because I didn't want to hurt their feelings."
148,It was a first person point of view and what happened is I was with a group of my friends and this guy that I am friends with in real life was in it but the thing is there was heavy flirtation between him and I and the interesting thing is that in real life I have heard from others friends that he may have feelings for me but basically we were at a kitchen counter and he came up behind me and gave me an intimate hug and we just looked at each other and then I woke up. I felt flustered but happy overall
159,"I had a dream I was kidnapped, and lots of other people were too it was in a weird house with this super closed off stair case and a banister on the second floor where you could see outside on the street and neighborhood. One person I remember was a middle-aged blonde woman and some other people of all ethnicity and ages. I established a relationship with the kidnapper and sort of fell in love with him. I didn't feel scared at all until the people found a way out of the house, and he snapped and jumped through the window and landed face down on the street I thought he was dead I ran outside to see, and then he stood up and had a gun my heart dropped I was scared I tried to run but my legs wouldn't move. I woke up"
160,Last night I had a dream I was with my hometown friends in a familiar place but I can't remember why it's familiar. I felt happy and relieved that we were all together again. I can't remeber what we were doing but I remember everyone laughing and talking about plans we had coming up.
161,"I was with all 4 of my friends, and we were driving on this dirt road with no lights, when all of a sudden, people started following us. I was extremely scared and was worried something would happen to me or my friends, and there was nothing I could do about it. It was in 3rd person, it was like I was seeing it from a bird's eye view."
165,"It was a nice somewhat sunny day outside and I was about to head to my college class when I somehow got information about my dad passing and in the moment I remember being upset and maybe even shedding a tear but I kept on my day. I knew I had to just make it through my one class I had and then when I got home I could break down and cry. Next thing I know I’m in my classroom and still thinking about how my dad had passed but then the class is over and everyone had left except for one girl who seemed hesitant to come up to me. I was still sitting down and then I was confused on why this girl who looked Hispanic with pin straight long black hair was walking up to me. She just came up to me and asked “Can I pray for you?” I was so confused and saddened because she had no idea who I was and had no idea my dad had passed. I didn’t think I gave off any indication that I was upset or look than I normally had in that class. Immediately after she asked me if she could pray for me I shook my head yeah and began to cry so hard, bawl even. I could feel how strong the emotion was that my head began to hurt a little. I remember thinking that it was crazy how this random girl had the urge to come pray for me specifically even though we didn’t know each other at all. I ended up waking up and had realized I actually had been bawling my eyes out and my nose even began to run. I of course in the dream was upset that my dad had passed away but it was really the fact of how I felt it was God showing me he was there for me at that time, even though my dad hadn’t passed away in reality. Like I had realized God worked through someone else to get to me or show he’s there for me in hard times. I feel like the reason why I started crying was because I felt reassurance from God that everything was going to be alright. Most of the dream happened in first person but whenever I teared up in the beginning of the dream it was a quick third person view so I could see myself but then I went back to first person. Later when the random girl put her hand on my head it went back the third person for a brief second."
171,I was in a school area as if I were at campus but it wasn't necessarily this specific campus. I was just walking around and then I went to go hang out with a friend. In my point of view everything happened as if I was there when it happened. I didn't really feel anything.
179,I really wanted a sign from my grandmother who passed away a year ago. She came to me in my dream. I was really nervous about a speech I was presenting to my class and then I had a dream about. In my dream I'm about to present and I forget everything I'm supposed to say. Then I see my grandma in the audience and suddenly remember everything. I'm really glad I got a sign from her and it felt good to know that she is still here for me even though she's in heaven now.
190,My dream was that my boyfriend was talking to other girls more than me and was ignoring me to talk to them. It made me very frustrated at him in my dream and I woke up for 1 second and was mad but he was actually just sleeping next to me and I realized that it wasn’t real. I just remember being so mad
195,"I was in a scene of the movie Coraline. We were in the house and the items came alive, and a cat was biting my hand. it was in first person. I felt happy and excited."
206,"I was in my room. The environment was quite tense and slightly uneasy because of a girl I was with. I thought we were just friends, but looking back, it's difficult to define our relationship. Regardless of our relationship title, we both loved and cared for each other. Her and I felt comfortable around each other. But we were arguing. Nothing crazy; speaking quietly and not yelling, though I was growing frustrated, annoyed, and anxious. I could feel my heart burning in my throat. I felt myself growing emotionally angry as I was passionate about whatever matter we were talking about. I was sitting at the foot of my bed and she was laying horizontally on the bed, as one typically does. Her laying down also made me more upset because I felt dismissed. Almost as if what I was saying was not important to her at all. That also increased my frustration. And she kept trying to calm me down because she could see my frustration growing. Then, mid tangent/rant/etc., she kissed me in my mouth. It was almost like an apology. Understandably, she felt bad. But after that, it wasn't just a kiss, it turned into a full makeout session. I remember being initially uncomfortable and afraid if someone was to walk into this one bedroom studio apartment; afraid someone was looking through the two windows that lined the corners of my room. Unbearably afraid and ashamed. I don't like women/girls in that way. I am sexually attracted to men. I couldn't help but be ashamed of myself. In my mind, I thought about how I was letting my family down by partaking in this, though I didn't even initiate it. I remember initially, after the first kiss, I was shocked. But after that initial shock, I closed my eyes and pressed in. It was something that in my head I knew was wrong, but in my heart it felt so good. So we continued. My heart rate was intensifying. I could feel myself yearning, almost like this was a part of myself I had silenced for so long that was awaiting to be freed and released. I was overindulgent. I lost it and I went crazy. Things escalated rather rapidly and we were about to do the deed. It was at that point that I had a moment of realization. I took a step back and thought about the fact that I don't like girls. The fact that I have a boyfriend. The fact that I've never had sex, let alone with a woman. I recognized I didn't know how to, and it hurt me to know that somewhere within me, that's what I wanted. I remember after that moment and during that moment, I felt fulfilled. Bonded to this girl, connected even. I felt free almost. Though that made no sense, as I felt so secretive and sneaky. Like I had to hide this. This confused me; how could something truly be freeing if I felt like I had to hide it from everything and everyone. I was confused. My feelings were array. Then, I woke up, still feeling aroused, yet so ashamed."
210,"First person. It was in a sort of mini auditorium (fold down, blue fabric classroom type chairs) in the corner of a building entrance with a lot of rooms next to it. Very bright and airy. I was in one of the adjoining rooms, which was empty but beige and classroom-like with the block walls and stubbly ceiling but there were windows facing the entrance/auditorium area, and I was on a phone interview. The interviewer sounded pretty bored and flat when asking me the questions, so I thought I was doing a bad job, however at the very end she (in the same tone) told me I was pretty much guaranteed the job. I don't remember what type of job it was, but I think it had something to do with being an assistant in some sort of medical practice. I ended the phone call happily, but for some reason decided to call back and ask questions. A different lady answered, and she sounded much more hostile. When I asked her questions about the job, she told me that she didn't know what I was talking about however referenced my application many times and told me it was awful and she didn't know why I was assuming that I had gotten the job when it wasn't official yet. I eventually hung up and felt really upset, but went to the auditorium area to try and calm down and find something to do. I saw my best friend there, but she didn't acknowledge me very much when I approached. Something happened in between but I forgot. Some sort of presentation begins to happen on stage, and when I approach my friend again to sit down next to her she claims, in a very standoffish tone, that all the chairs in her row are saved for other people, even though only about half of them were filled up. I'm obviously hurt by this but trying not to act like it, so I just decided to leave and not watch the presentation. As I'm leaving, she comes up to me to ask if I was upset, to which I responded that I was fine. She doesn't believe me, and told me that we could hang out after the presentation, but I felt hurt and didn't really want to, even though I said that we could hang out afterwards. As I walk further into the entrance room (away from the stage), the woman on stage starts to speak very oddly and almost cult-like about things that she hates. I realize after listening for a bit that it's the same lady that I spoke with on the phone the second time. She looked like a regular middle aged woman, but the way she moved and spoke felt oddly unhinged and threatening. She would say that she hated something, and then all of the crowd in the chairs would repeat after her that ""we"" hate that thing. It was a lot of random things, like dogs or chairs(? for some reason). Eventually, during this routine that I'm watching in sort of fascination, she looks directly at me and points, chanting the same ""we hate"" speech with my full name. The crowd turns to look at me and does the same thing. It's a small crowd and none of them came towards me, but I felt physically threatened and scared by this. It all felt very cult-ish. I don't remember what happened afterwards, but I think I woke up soon after."
213,"I was sitting on the edge of a cliff looking down on a town that was big but looked little. I had a massive pencil or stick and I would draw the town into creation. Every time I would make something and no matter what I tried to make it would come out a different color or slightly different shape than I wanted it too. I kept drawing just to draw something how I imagined it and when I looked up I was in my dorm room, then I woke up"
215,After my grandfather died i had a dream that someone in my family died and i woke up at 4:55am. Had the same exact dream the next night and woke up at 4:55am.
219,It was a nightmare that i have sometimes that changes ever so slightly. I wake up in my room with a snake in my bed and when it comes close to me it explodes into thousands of spiders then i will wake up.
220,I was in a color war between all the different colors and people were attacking others with pool noodles of their color. then at the end of the war there was this giant old house that was like a haunted house. we had to go through it and it was falling apart and there were also giant pink portals that we couldn't fall into. then we played hide and seek with a giant one eyed monster. there was the timer from my jiu-jitsu gym that counted down from 5 minutes which was how long we had to survive the hide and seek. there was a black and while dalmation that almost gave me away but he didnt. then at the end my uncle and aunt and cousin were there to celebrate us surviving with a delicious vanilla cake.
221,"It was all first person. It was hard to distinguish that it was a dream due to that factor. It took place in my dorm and on campus. All the locations were accurate to how they are in real life. My dorm had my desk with funko pops, my computer, and lego flower as well as all my posters on the wall. All the campus buildings involved seemed normal, the primary one was Wescoe hall. The dream was simple, but uncomfortable. I checked my canvas account and realized I had been enrolled in an art class: an art class I had never attended because I didn't realize that I was enrolled in it. I started to panic in my room trying to remember how I got enrolled in this class and if I had actually been taking it. Fear set in as if I had missed every class for a half of a semester, then I would definitely face repercussions. I changed in a hurry in my dorm, the world spinning around me, and then ran to Wescoe. That is where the dream ended. It was very realistic and felt like a boarder between dream and reality. I woke up thinking I took an art class."
222,"I had a dream the other night where I was at my boyfriend's house late at night and we were watching some TV show. I got a call that my mom had gotten into a terrible accident and that they didn't know if she was going to make it. I remember not being able to breathe and falling to the floor. Then the dream kind of skipped forward to me living life normally then randomly having trouble breathing thinking about my mom, but at that point no one seemed to understand or care. It was a terrible dream and I felt like my world was falling apart, I remember waking up sweating. I only remember parts and how it didn't all really make sense, but it was bad. It was in first-person the whole time."
225,It was frazy I thought i was on a trip
227,"I was in a dorm, and we had turned two lofted beds into one by pushing them together. My friend and I woke up in the dream, and their roommate had come home early and found their room completely rearranged. Their bed was NOW ATTACHED TO my friend's, and they were very confused."
228,"I only remember a small part of my dream, but I was eating dinner with my ex boyfriend at a restaurant that looked familiar; however, I could not remember the name of it when I woke up. It was a very short dream of us talking at dinner at a two person table."
229,"I was at the Emporia Zoo with my boyfriend, he's tall, brunette, and has blue eyes, and he was wearing a black shirt and shorts. I was wearing a yellow sweater and jean shorts with my hair curled, and he proposed to me at the zoo and we automatically got married there. However, another couple got married at the same exact time as us and my whole family was around and then it ended. I was very happy in my dream, but felt a little weirded out since another couple was getting married right next to us."
235,"In my recent memorable dream, my mom had a newborn baby which was very weird because my dad cant have kids anymore. My parents last kid is 9 years old, so my mom was spending a lot of time focusing on this baby and not her other kids since they were all old enough to take care of themselves. She was telling me how she felt bad for Evie (the 9 year old). She let me see the baby for a little and during that one of our friends Marcy came over and hung out with us. I was very confused by the dream because my parents cant have kids together."
236,I keep having dreams of my Ex boyfriend. We broke up 5 months ago. I had a dream that was first person and we were on some vacation. I remember feeling super upset and sad. I walked into a room and he was with a random girl from my high school cheating on me.
242,"A few nights ago, I dreamed of me living in Chicago standing on a rooftop overlooking the city. The air was cold, and I could smell the rain and the food trucks down on the streets. I could hear the hum of cars and trains echoing through the streets. Suddenly, the sky turned a deep shade of pink, and snow began to fall even though it was the middle of summer. I streched my hand out to catch a snowflake, for a moment the city began to glow and I felt this powerful mix of loneliness and hope.  Like the world was huge, but somehow still meant for me."
243,I was swimming constantly at a swim meet and couldn't make myself stop.
246,"Me and my old debate coach who sexually harassed me were alone in my old debate room. It was set up the exact same way I remember it. It was a long room with no windows, and two long tables horizontal in the back, that contrasted the rows of desks. I can't recall where we were in the room, but he was rapeing me."
255,"I was swimming off a tropical beach with my mother. My mother has medium length blonde hair, and I myself have short, strawberry blonde hair. We were swimming across the water to an island on the other side. We were halfway across the water when a large, great white shark came. It taunted and watched us. We tried swimming faster but then it grabbed my mother by the hand and next thing I knew she was gone. I don't know where it took her, but next thing I remember I was swimming back. I was underwater the whole time and swimming extremely fast for a human, almost in a beaver-like manner. About halfway to the beach, their shark came back. I played dead and buried myself in the sand a bit at the bottom of the water. I remember the shark said something to itself but I don't quite remember what. Almost like he forgot something that he needed in order to eat me at the other end of the water. Nonetheless, he turned around and left me to go get that thing. I then began swimming in that very fast, beaver-like manner, until I was almost back to a dock on the beach when I noticed the shark behind me again. He was swimming very fast and ferocious, but I somehow reached the dock before he got to me. I looked at him and his fin swimming around the dock, like he was waiting for me to come back in. I then left and walked up to a wooden hut/beach house behind the beach. I remember feeling very worried and stressed throughout the whole dream. I was confused and what he had done and where he had taken my mother. I remember there were more people at the hut once I left, but I don't remember who or what happened after that."
257,I dreamt that my professor told me where my class was and it was in the wrong building and I couldn't where it actually was located and I set my alarm for 5 am to find this class and when I got there everyone there made fun of me because in the class that I was missing trying to locate was watching on the screen a video surveillance of me going to the place he told me it was and it was humiliating and I woke up feeling really embarrassed and intimidated by my peers.
259,I had a dream about my friend and losing them in a crowd. It was loud and hard to breathe.
260,"I don't really remember much of it but it was a series of unorganized events, like I kept doing activities that kept switching. And eventually I was in a car with my friends and we were driving, and for some reason we were angry. In the midst of that, it started snowing and we drifted off the road and died."
263,I was in the Arizona country side living on a ranch. My family and I were famous for horse racing and would care for horses. So I was training with my sister on the race track with our best horse. I road the horse three times around and stopped to let my sister on. The moment I let her on the horse it became angry and started jumping around. My sister was thrown off and she ran back to the house. I stayed behind and was blinded by a puff of dust. When I could see again I saw the horse but it had the body of a buff person. It started chasing me around the race track and my family was watching me from the porch. I tried to get their help but they just stood there laughing at me. My point of view changed to my sister and I could see myself getting chased by this buff horse and that's when the dream ended.
276,"I believe it was always my point of view. I don't remember a lot, but my roommates were gone and I thought they died, and I was scared and sad because I didn't know where they went."
277,"My recent dream involved me and a few friends going to the tetons and renting a cabin. The dream was in my perspective and was a single day of the trip and started off with me sitting at a table eating breakfast with my friends. I felt very relaxed but also super tired which kind of sucked and I was eating bacon and breakfast potatoes. It then sort of skipped to us packing up to go on a large hike though I do not remember the trail. We packed snacks, drinks, and our swimsuits as we knew there would be a lake along the trail. As we started, I remember feeling relaxed and happy as it has always been on my bucket list to experience the tetons. Through the hike, my friends and I talked a lot about life and how we will never forget this. Here and there I would take photos of the beautiful scenery with my new camera which made me feel accomplished because the photos started to become better as the trip went on. As the hike went on, I started to feel a little tired. The dream then sort of skipped again to the lake we got to and I remember me and my friends swimming for a while because it was such a nice lake and the scenery was immaculate. We played with a football and took a ton of photos. We then changed back into our old clothes and made our way to the peak of the mountain. As we got to the top the sun was beginning to set and the sunset was insane. I remember one of my friends saying ""wow"" as it was the coolest thing he had ever seen. We all took the time to appreciate everything in front of us while taking numerous photos. I remember the dream feeling super relaxed and almost like a video edit because of how cool it was. As soon as we started to leave, the dream stopped and I woke up."
